{"allowed_seed_paths":["context-guard-kit/context_pack.py"],"authorization_ref":"auth-p0-001","checker_id":"check-p0-001","descriptor_id":"desc-p0-001","descriptor_sha256":"1996a8b7890e55d832a67ee76b725840fabc34c2b3eb6ce7f10cf4d3c19cadf1","eligible_host_versions":["2.1.221"],"evidence_classes":["code","test"],"expansion_policy_version":"expand-v1","language_id":"python","max_expansions":2,"max_pack_bytes":8192,"max_source_count":8,"pair_id":"pair-p0-001","protected_zone_policy_id":"protected-v1","render_policy_version":"render-v1","repository_policy_id":"repo-v1","revision_policy_id":"revision-v1","schema_version":"v1","selection_policy_version":"select-v1","stratum_id":"stratum-p0-001","study_manifest_sha256":"bbbbbbbbbbbbbbbbbbbbbbbbbbbbbbbbbbbbbbbbbbbbbbbbbbbbbbbbbbbbbbbb","task_id":"task-p0-001"}
